{
  "city": "Paris",
  "name": "Hypnétique",
  "phone": "06 58 13 93 28",
  "department": "75",
  "instagram": "hypnetique",
  "status": "published",
  "twitter": "hypnetique",
  "website": "https://www.instagram.com/hypnetique/",
  "id": "hypnetique",
  "image": "https://www.hypnetique.fr/wp-content/uploads/2024/01/Profil-Florian-Hypnetique-1024-840.jpg",
  "description": "𝔽𝕝𝕠𝕣𝕚𝕒𝕟, Le Plus Grand Hypnotiseur de France (2m00) 😜\nSpectacle Ethique & Bienveillant 🤗\nHumoriste stand-up 🎙️ \nInfos Animation Hypnose 👇",
  "rating": 5
}
